{
  "$schema": "https://json-schema.org/draft/2020-12/schema",
  "$id": "https://macp.dev/schemas/macp-envelope.schema.json",
  "title": "MACP Envelope (Canonical JSON Mapping)",
  "type": "object",
  "required": [
    "macp_version",
    "mode",
    "message_type",
    "message_id",
    "session_id",
    "sender",
    "timestamp"
  ],
  "properties": {
    "macp_version": {
      "type": "string",
      "minLength": 1,
      "description": "MACP protocol version (semantic versioning).",
      "pattern": "^[0-9]+\\.[0-9]+(\\.[0-9]+)?([-+][0-9A-Za-z.-]+)?$"
    },
    "mode": {
      "type": "string",
      "description": "Empty string for Ambient Signals; empty or non-empty for Progress (see §6, both forms are valid but MUST agree with session_id); canonical mode identifier for session-scoped messages (for example macp.mode.decision.v1)."
    },
    "message_type": {
      "type": "string",
      "minLength": 1,
      "description": "Message type discriminator (e.g., Signal, SessionStart, Commitment). For Mode-defined payloads, interpreted relative to `mode`: (mode, message_type) is the discriminating key for a payload's declared type, since more than one Mode may declare a payload of the same name — an implementation MUST NOT assume a given message_type denotes the same payload type across Modes. Mode-independent Core types (Signal, Progress, SessionStart, SessionCancel, SessionSuspend, SessionResume, Commitment) each denote one payload type regardless of mode; Ambient Signals carry an empty `mode` and remain fully identified by message_type alone."
    },
    "message_id": {
      "type": "string",
      "minLength": 1,
      "description": "Globally unique message identifier (format is deployment-defined)."
    },
    "session_id": {
      "type": "string",
      "description": "Empty string for Ambient Signals; empty or non-empty for Progress (see §6, both forms are valid but MUST agree with mode); non-empty for session-scoped messages."
    },
    "sender": {
      "type": "string",
      "minLength": 1,
      "description": "Agent identifier for the sender."
    },
    "timestamp": {
      "type": "string",
      "format": "date-time",
      "description": "RFC3339 timestamp string (UTC recommended)."
    },
    "payload": {
      "description": "Decoded JSON payload form (preferred for Core payloads and readable messages)."
    },
    "payload_b64": {
      "type": "string",
      "description": "Opaque payload bytes encoded as base64 (use when payload is opaque or binary).",
      "contentEncoding": "base64"
    }
  },
  "oneOf": [
    {
      "required": [
        "payload"
      ],
      "properties": {
        "payload": {
          "description": "Decoded JSON payload form (preferred for Core payloads and readable messages)."
        }
      },
      "not": {
        "required": [
          "payload_b64"
        ]
      }
    },
    {
      "required": [
        "payload_b64"
      ],
      "properties": {
        "payload_b64": {
          "type": "string",
          "description": "Opaque payload bytes encoded as base64 (use when payload is opaque or binary).",
          "contentEncoding": "base64"
        }
      },
      "not": {
        "required": [
          "payload"
        ]
      }
    }
  ],
  "allOf": [
    {
      "if": {
        "properties": {
          "message_type": {
            "const": "Signal"
          }
        },
        "required": [
          "message_type"
        ]
      },
      "then": {
        "properties": {
          "mode": {
            "maxLength": 0
          },
          "session_id": {
            "maxLength": 0
          },
          "payload": {
            "$ref": "#/$defs/SignalPayload"
          }
        }
      }
    },
    {
      "if": {
        "properties": {
          "message_type": {
            "not": {
              "enum": ["Signal", "Progress"]
            }
          }
        },
        "required": [
          "message_type"
        ]
      },
      "then": {
        "properties": {
          "mode": {
            "minLength": 1
          },
          "session_id": {
            "minLength": 1
          }
        }
      }
    },
    {
      "if": {
        "properties": {
          "message_type": {
            "const": "SessionStart"
          }
        },
        "required": [
          "message_type"
        ]
      },
      "then": {
        "properties": {
          "payload": {
            "$ref": "#/$defs/SessionStartPayload"
          }
        }
      }
    },
    {
      "if": {
        "properties": {
          "message_type": {
            "const": "SessionCancel"
          }
        },
        "required": [
          "message_type"
        ]
      },
      "then": {
        "properties": {
          "payload": {
            "$ref": "#/$defs/SessionCancelPayload"
          }
        }
      }
    },
    {
      "if": {
        "properties": {
          "message_type": {
            "const": "SessionSuspend"
          }
        },
        "required": [
          "message_type"
        ]
      },
      "then": {
        "properties": {
          "payload": {
            "$ref": "#/$defs/SessionSuspendPayload"
          }
        }
      }
    },
    {
      "if": {
        "properties": {
          "message_type": {
            "const": "SessionResume"
          }
        },
        "required": [
          "message_type"
        ]
      },
      "then": {
        "properties": {
          "payload": {
            "$ref": "#/$defs/SessionResumePayload"
          }
        }
      }
    },
    {
      "if": {
        "properties": {
          "message_type": {
            "const": "Commitment"
          }
        },
        "required": [
          "message_type"
        ]
      },
      "then": {
        "properties": {
          "payload": {
            "$ref": "#/$defs/CommitmentPayload"
          }
        }
      }
    },
    {
      "if": {
        "properties": {
          "message_type": {
            "const": "Progress"
          }
        },
        "required": [
          "message_type"
        ]
      },
      "then": {
        "properties": {
          "payload": {
            "$ref": "#/$defs/ProgressPayload"
          }
        },
        "anyOf": [
          {
            "properties": {
              "mode": {
                "maxLength": 0
              },
              "session_id": {
                "maxLength": 0
              }
            }
          },
          {
            "properties": {
              "mode": {
                "minLength": 1
              },
              "session_id": {
                "minLength": 1
              }
            }
          }
        ]
      }
    }
  ],
  "$defs": {
    "Base64Bytes": {
      "type": "string",
      "description": "Protobuf bytes mapped to base64 string in JSON.",
      "contentEncoding": "base64"
    },
    "Root": {
      "type": "object",
      "required": [
        "uri"
      ],
      "properties": {
        "uri": {
          "type": "string",
          "minLength": 1,
          "description": "Absolute URI boundary."
        },
        "name": {
          "type": "string"
        }
      }
    },
    "SignalPayload": {
      "type": "object",
      "required": [
        "signal_type"
      ],
      "properties": {
        "signal_type": {
          "type": "string",
          "minLength": 1
        },
        "data": {
          "$ref": "#/$defs/Base64Bytes"
        },
        "confidence": {
          "type": "number"
        },
        "correlation_session_id": {
          "type": "string"
        }
      }
    },
    "SessionStartPayload": {
      "type": "object",
      "required": [
        "ttl_ms",
        "mode_version",
        "configuration_version"
      ],
      "properties": {
        "intent": {
          "type": "string"
        },
        "participants": {
          "type": "array",
          "items": {
            "type": "string"
          }
        },
        "mode_version": {
          "type": "string",
          "minLength": 1
        },
        "configuration_version": {
          "type": "string",
          "minLength": 1
        },
        "ttl_ms": {
          "type": "integer",
          "minimum": 1,
          "description": "Session TTL in milliseconds."
        },
        "roots": {
          "type": "array",
          "items": {
            "$ref": "#/$defs/Root"
          }
        },
        "policy_version": {
          "type": "string"
        },
        "context_id": {
          "type": "string",
          "description": "Globally-unique context reference (e.g. ctx:sha256:<hex>, a URI, or any opaque string). The runtime preserves it but MUST NOT interpret it."
        },
        "extensions": {
          "type": "object",
          "additionalProperties": {
            "$ref": "#/$defs/Base64Bytes"
          },
          "description": "Generic extension blocks keyed by protocol identifier. Values are base64-encoded protocol-specific bytes."
        },
        "max_suspend_ms": {
          "type": "integer",
          "minimum": 0,
          "description": "Maximum cumulative suspended duration in milliseconds before a SUSPENDED session transitions to EXPIRED (RFC-MACP-0001 §7.5). 0 or absent means the runtime's configured default; the resolved cap MUST be recorded on the session for replay (RFC-MACP-0003 §2)."
        }
      }
    },
    "SessionCancelPayload": {
      "type": "object",
      "required": [
        "reason"
      ],
      "properties": {
        "reason": {
          "type": "string",
          "minLength": 1
        },
        "cancelled_by": {
          "type": "string"
        }
      }
    },
    "SessionSuspendPayload": {
      "type": "object",
      "required": [
        "reason"
      ],
      "properties": {
        "reason": {
          "type": "string",
          "minLength": 1
        },
        "suspended_by": {
          "type": "string"
        }
      }
    },
    "SessionResumePayload": {
      "type": "object",
      "required": [
        "reason"
      ],
      "properties": {
        "reason": {
          "type": "string",
          "minLength": 1
        },
        "resumed_by": {
          "type": "string"
        },
        "banked_ms": {
          "type": "integer",
          "minimum": 0,
          "description": "Milliseconds of TTL banked during the suspension and restored to the session's absolute deadline on resume (RFC-MACP-0001 §7.5, RFC-MACP-0003 §2). 0 or absent means no TTL was banked (e.g. a suspension recorded with no remaining TTL); a proto3 implicit-presence encoder MAY omit a zero value (RFC-MACP-0001 §10.7 mandates non-omission only for empty string fields)."
        }
      }
    },
    "CommitmentPayload": {
      "type": "object",
      "required": ["commitment_id"],
      "properties": {
        "commitment_id": {
          "type": "string",
          "minLength": 1
        },
        "action": {
          "type": "string",
          "description": "Action identifier describing the outcome. Mode RFCs define the normative vocabulary (e.g., 'decision.approved', 'task.failed', 'quorum.rejected')."
        },
        "authority_scope": {
          "type": "string"
        },
        "reason": {
          "type": "string"
        },
        "mode_version": {
          "type": "string"
        },
        "policy_version": {
          "type": "string"
        },
        "configuration_version": {
          "type": "string"
        },
        "outcome_positive": {
          "type": "boolean",
          "description": "True for positive/successful outcomes; false for definitive negative outcomes. Modes that allow negative commitments MUST set this field explicitly."
        },
        "supersedes": {
          "$ref": "#/$defs/CommitmentRef",
          "description": "Cross-session supersession (RFC-MACP-0001 §7.3.1): when present, this commitment supersedes a prior one identified by {session_id, commitment_hash}. Always emitted in a NEW session — a RESOLVED session accepts no further messages."
        }
      }
    },
    "CommitmentRef": {
      "type": "object",
      "required": ["session_id", "commitment_hash"],
      "properties": {
        "session_id": {
          "type": "string",
          "minLength": 1
        },
        "commitment_hash": {
          "type": "string",
          "pattern": "^sha256:[0-9a-f]{64}$",
          "description": "Canonical commitment hash of the superseded CommitmentPayload (RFC-MACP-0013)."
        }
      }
    },
    "ProgressPayload": {
      "type": "object",
      "properties": {
        "progress_token": {
          "type": "string",
          "description": "Token linking this progress update to a prior request."
        },
        "progress": {
          "type": "number",
          "minimum": 0,
          "description": "Current progress value."
        },
        "total": {
          "type": "number",
          "minimum": 0,
          "description": "Total work units (progress is relative to this value)."
        },
        "message": {
          "type": "string",
          "description": "Human-readable progress description."
        },
        "target_message_id": {
          "type": "string",
          "description": "The message_id of the request this progress relates to."
        }
      }
    }
  }
}
