{
  "macp_version": "1.0",
  "mode": "macp.mode.decision.v1",
  "message_type": "SessionSuspend",
  "message_id": "01HV0Q2Z3YQ2R5WZ9VQJH0D1X2",
  "session_id": "01HV0Q2A8W0Y2XQ5N1R8Y2K9B3",
  "sender": "runtime://macp.example",
  "timestamp": "2026-03-01T20:29:00Z",
  "payload": {
    "reason": "Paused for human review",
    "suspended_by": "user://alice"
  }
}
