{
  "macp_version": "1.0",
  "mode": "macp.core.signal.v1",
  "message_type": "Signal",
  "message_id": "01HV0Q1Y8J1J9Q3C2A6JH0ZP3K",
  "session_id": "",
  "sender": "agent://telemetry.observer",
  "timestamp": "2026-03-01T20:24:00Z",
  "payload": {
    "signal_type": "observation.latency",
    "data": "AAECAwQ=",
    "confidence": 0.92
  }
}