{
  "macp_version": "1.0",
  "mode": "macp.mode.decision.v1",
  "message_type": "SessionResume",
  "message_id": "01HV0Q2Z3YQ2R5WZ9VQJH0D1X3",
  "session_id": "01HV0Q2A8W0Y2XQ5N1R8Y2K9B3",
  "sender": "runtime://macp.example",
  "timestamp": "2026-03-01T21:14:00Z",
  "payload": {
    "reason": "Review complete, resuming",
    "resumed_by": "user://alice",
    "banked_ms": 1620000
  }
}
