{
  "macp_version": "1.0",
  "mode": "macp.mode.decision.v1",
  "message_type": "SessionCancel",
  "message_id": "01HV0Q2Z3YQ2R5WZ9VQJH0D1X1",
  "session_id": "01HV0Q2A8W0Y2XQ5N1R8Y2K9B3",
  "sender": "runtime://macp.example",
  "timestamp": "2026-03-01T20:28:00Z",
  "payload": {
    "reason": "User requested cancellation",
    "cancelled_by": "user://alice"
  }
}