{
  "macp_version": "1.0",
  "mode": "",
  "message_type": "Progress",
  "message_id": "01HV0Q3A9K2M5R7T1WYB0F4C6D",
  "session_id": "",
  "sender": "agent://worker.render",
  "timestamp": "2026-03-01T20:30:00Z",
  "payload": {
    "progress_token": "tok-render-0001",
    "progress": 40,
    "total": 100,
    "message": "Rendering frame 40 of 100",
    "target_message_id": "01HV0Q2F1B3N6S8U2XZC1G5D7E"
  }
}
